,Lyrics
"""Hold On""",treated bad wrong dear since since went away know hang around sit around sit around head hanging wonder wonder wonder loving ooh first mistake wanted much time morning noon night would known thing know might lost time complain waste time fighting blind minded thought despair hold love got hold hold love ooh hoo baby hold hold love got hold hey hold love ooh might also like art playing game heart break bout good love make heart fire give love every day remember need space patient give heart waste time fighting blind minded thought despair hold love got hold hey hold love got hold love yeah hey hold love baby hold hold love baby hold trust honesty must golden rule feel strength passion soul burn deeply within magic share sacrifice show much care waste time fighting blind minded thought despair hold love got hold hold love let keep tie hold love hang tight let hold love ooh school let hold love hold love ooh hold love love need really want hold love ooh keep keep hanging hold little trust honesty golden rule hold feel strength passion soul burning deep hold faith keep fire burning home hold hey yeah come home hold want hold time hold little faith blinded hold thought despair hold love thought despair hey waste hold 
"""It Must Have Been Love""",must love lay whisper pillow leave winter ground wake lonely air silence bedroom around around touch close eye dream away must love must good lost somehow must love moment touched til time run make believing together sheltered heart outside turn water like teardrop palm hard winter day dream away might also like must love must love wanted living without must love must love water flow wind blow must love must love must good lost somehow must love must love moment touched till time run yeah must love must love wanted living without must love water flow wind blow must love must love 
"""Nothing Compares 2 U""",seven hour fifteen day since took love away every night sleep day since took love away since gone whatever want see whomever choose eat dinner fancy restaurant nothing said nothing take away blue cause nothing compare nothing compare lonely without like bird without song nothing stop lonely tear falling tell baby wrong could put arm around every boy see remind went doctor guess told guess told said girl better try fun matter fool cause nothing compare nothing compare might also like flower planted mama backyard died went away know living baby sometimes hard willing give another try nothing compare nothing compare nothing compare nothing compare nothing compare nothing compare 
"""Poison""",yeah spyderman freeze full effect huh ready ron ready ready biv ready slick yeah break girl must warn sense something strange mind situation serious let cure cause running time beautiful relationship seem start deadly love together heart drivin mind hard find get head miss kiss love wrong move dead might also like girl poison never trust big butt smile girl poison poison caution step meet fly girl know cause portion think best thing world fly drive right mind steal heart blind beware schemin make think dreamin fall love screamin demon poison deadly movin slow lookin mellow fellow like devoe gettin paid laid better lay low schemin house money whole show low pro cut like afro see sayin huh winner know loser know crew used poison poison poison poison poison poison poison poison poison poison poison poison poison poison poison poison park shake breakin takin night played wall checkin fella high low keepin one eye open still clockin hoe one particular girl stood rest poison high power chest michael bivins runnin show bell biv devoe know slick blow drivin mind hard find get head miss kiss love wrong move dead girl poison never trust big butt smile girl poison poison fella end know sayin mike yeah full effect wassup ralph johnny forget boy brown whole crew poison 
"""Vogue""",strike pose strike pose vogue vogue vogue vogue vogue vogue look around everywhere turn heartache everywhere look around try everything escape pain life know life know else fails long something better today know place get away called dance floor come vogue vogue let body move music move music hey hey hey come vogue vogue let body flow flow know might also like need imagination use inside finest inspiration dream open door open door make difference black white boy girl music pumping give new life superstar yes know come vogue vogue vogue let body groove music groove music hey hey hey come vogue vogue vogue let body flow flow know beauty find bump grind soul musical feel beautiful magical life ball get dance floor vogue vogue let body move music move music hey hey hey come vogue vogue vogue let body flow flow know vogue vogue beauty find move music vogue vogue beauty find flow greta garbo monroe dietrich dimaggio marlon brando jimmy dean cover magazine grace kelly harlow jean picture beauty queen gene kelly fred astaire ginger rogers dance air style grace rita hayworth gave good face lauren katharine lana bette davis love lady attitude fella mood stand let get strike pose nothing vogue vogue oooh got let body move music oooh got let body flow oooh got vogue vogue vogue vogue 
"""Vision of Love""",treated kind sweet destiny carried desperation one waiting took long still believed somehow one needed would find eventually vision love given prayed night felt alone suffered alienation carried weight strong believed know succeeded finding place conceived vision love given vision love given might also like realized dream visualized love came feel alive thankful received answer heaven sent treated kind sweet destiny eternally grateful holding close prayed night faithfully knowing one needed would find eventually vision love given vision love turned 
"""Another Day in Paradise""",call man street sir help cold nowhere sleep somewhere tell walk look back pretend hear start whistle cross street seems embarrassed think twice cause another day paradise think twice cause another day paradise think call man street see cry got blister sol foot walk trying think twice cause another day paradise think twice another day paradise might also like think lord nothing anybody lord must something say tell line face see probably moved every place cause fit think twice cause another day paradise think twice another day paradise think mhm think another day paradise another day paradise para paradise paradise think paradise think para paradise paradise mhm paradise paradise 
"""Cradle of Love""",rock cradle love rock cradle love yes cradle love rock easily true well rock cradle love rocked cradle love yes cradle love rock easily true well burned like ball fire rebel took little child bride tease yeah easy yeah cause love cut million way shake devil misbehaves nobody fool come shake whatever rorwar rock cradle love whoo rock cradle love yes cradle love rock easily true yeah sent heaven right rob cradle love yes page love talk decently true might also likeyeah flesh romeo yeah baby hear moan easy know please yeah cause love start rollin train stop vain nobody fool come shake whatever whoo oooh yeah wage love know rock cradle woo yeah right wage love ooh yeah rock cradle yeah yeah yeah yeah yeah yeah whoo psycho baby take look baby well burned like ball fire rebel took little child bride tease yeah know please yeah well love start rollin train stop vain nobody fool come shake whatever rock cradle love yeah rock cradle love ooh sent heaven right rock cradle love rock cradle love yeah cradle love mama robbed devil love right cradle love tease tonight might sleaze right appease tonight let ease yeah rock cradle love ooo yeah cradle love right snatch back salvation soul mama yeah wow 
"""Blaze of Glory""",wake morning raise weary head got old coat pillow earth last night bed know goin god know devil run six gun lover candle wind brought world say born sin well least gave somethin steal win well tell wanted yeah wanted man colt stable cain abel catch goin blaze glory take know truth goin blaze glory lord never drew first drew first blood one son call young gun ask conscience offer soul ask grow wise man well ask grow old ask known love like sing song rain well seen love come seen shot seen die vain shot blaze glory take know truth cause goin blaze glory lord never drew first drew first blood devil son call young gun might also like night bed pray lord soul keep lookin forgiveness six foot deep lord got ask favor hope understand cause lived life fullest let boy die like man starin bullet let make final stand shot blaze glory take know truth goin blaze glory lord never drew first drew first blood one son call young gun young gun young gun young gun 
"""Do Me!""",take good look tell like see think think kiss pretty baby touch girl make think think girl baby baby think baby baby yeah girl let hair take clothes leave shoe would mind look moment make sweet love backstage age adolescent doin fine replied sighed like wild thing action took place kinda wet forget need body bag might also like baby baby wan baby yeah yeah baby yeah baby like morning time baby sometimes love evening baby baby girl baby yeah time clock swatch watch time chill got date late hey girl gon move jacuzzi ooh booty smack flip rub baby yeah baby like like baby yeah baby move little bit closer morning night wan morning night wan 
"""How Am I Supposed to Live Without You""",could hardly believe heard news today come get straight said leavin someone swept heart away look upon face see true tell tell bout plan makin tell one thing tell supposed live without loving long supposed live without supposed carry livin gone proud cryin come break dream mine coming end blame built world around hope one day much friend wan know price gon pay dreaming even take might also like tell supposed live without loving long supposed live without supposed carry livin gone wan know price gon pay dreaming dream come true tell supposed live without lovin long supposed live without supposed carry livin gone 
"""Pump Up the Jam""",pump jam pump foot stomping jam pumping look ahead crowd jumpin pump little get party goin dance floor see cause party find awa place stay get booty floor tonight make day awa place stay get booty floor tonight make day make day make day make day make day pump jam pump foot stomping jam pumping look ahead crowd jumpin pump little get party goin dance floor see cause party find might also like awa place stay get booty floor tonight make day awa place stay get booty floor tonight make day make day make make day make day make day make make make day pump jam pump pump pump pump jam pump pump pump pump jam pump pump pump pump jam pump pump jam pump jam pump jam pump pump pump pump pump jam pump jam pump jam pump pump jam pump foot stomping jam pumping look crowd jumpin pump little get party goin dance floor see cause party find bad awa place stay get booty floor tonight make day awa place stay get booty floor tonight make day pump jam pump pump pump pump jam pump pump pump jam pump pump pump pump jam pump pump jam pump pump pump pump jam pump pump pump jam pump pump pump pump jam pump pump pump make day make day make make make make day make day make day make make make make day awa place stay get booty floor tonight make day awa place stay get booty floor tonight make day awa place stay get booty floor tonight make day awa place stay get booty floor tonight make day 
"""Opposites Attract""",baby seems never ever agree like movie like take thing serious take light bed early party night friend saying gon last cause move slowly baby fast like quiet love shout get together work take two step forward take two step back come together cause opposite attract know fiction natural fact come together cause opposite attract thought could lover make bed steal cover like neat make mess take easy baby get obsessed got money always broke like cigarette like smoke thing common one get together nothin fun might also like take two step forward take two step back come together cause opposite attract know fiction natural fact come together cause opposite attract two step forward two step back come together cause opposite attract know fiction natural fact come together cause opposite attract know baby baby come together come together baby something lasted long proving everyone wrong think ever get difference patched really matter cause perfectly matched take two step forward take two step back come together cause opposite attract know fiction natural fact come together cause opposite attract two step forward two step back come together cause opposite attract know fiction natural fact come together cause opposite attract two step forward two step back two step back come together cause opposite opposite attract fiction know fact fact come together cause opposite opposite two step forward two step back two step back opposite attract together together two step forward two step back two step back 
"""Escapade""",walkin saw standin smile lookin shy caught eye thought want hang well like know friday hope find time weekend relax unwind mind tired worked hard week ooh week cashed check ready promise show good time come baby let get away let save trouble another day come got made let take escapade let pade good time pade leave worry behind pade well mine pade escapade might also like hold back good time make rule along break havin fun come baby let get away let save trouble another day come got made let take escapade escapade baby come baby let get away let save trouble another day come got made let take escapade let minneapolis come pade good time pade leave worry behind pade well mine pade escapade ooh mind tired ooh worked hard ooh worked hard week week got paid got made ready promise show good time come baby let get away baby come let save trouble another day save another day come got made baby come yeah let take escapade escapade baby take escapade come baby let get away baby come let save trouble another day save another day come got made escapade let take escapade let come baby let get away let save trouble another day come got made let take escapade escapade baby 
"""All I Wanna Do Is Make Love to You""",came sight standing road umbrella coat pulled along side offered ride accepted smile drove ask name lonely boy rain fate tell right love first sight please make wrong stay night wan make love say want wan make love got loving arm hold onto found hotel place knew well made magic night everything right might also likehe brought woman many time easily morning woke left note told flower seed walked garden planted tree try find please dare live memory always wan make love one night love knew wan make love got loving arm hold onto whoa made love love like stranger night long made love happened one day came round way imagine surprise saw eye said please please understand love another man give whoa one little thing wan make love one night love knew wan make love come say want wan make love one night love knew wan make love say baby want night long night long night long night long wan wan wan wan wan make love one night love 
"""Close to You""",jezebel miss brixton queen living life like bad sweet dream telling lie truth clear think knew wanted hear spinning around like wheel fire walking tightrope love highwire fatal attraction escaping wan close thing want wan close show way feel feel love lying midnight hour holding like dream love never seems touch holding way feel girl make dream come true make dream come true might also like wan close thing want wan close show way feel gemini cusp mar hold back go far winding let emotional gagged bound meet eye devil woman locked inside formal rising scared think possesed wan close thing want wan close show way feel feel love everytime body next mine somethin deep inside want love endlessly touch girl know make feel believe real believe real wan close thing want wan close show way feel attitude explain never know flame tying elastic word countdown till get hurt blood hot burned bright neon sign night hard say went far heart still bear scar wan close wan close wan close jezebel bursting queen living life like bad sweet dream telling lie truth clear think knew wanted hear wan close spinning around like wheel fire walkin tightrope love highwire fatal attraction escaping wan close thing want wan close wan close baby show way feel wan close thing want wan close show way 
"""Black Velvet""",mississippi middle dry spell jimmie rodgers victrola high mama dancin baby shoulder sun settin like molasses sky boy could sing knew move everything always wanting leave longing black velvet little boy smile black velvet slow southern style new religion bring knee black velvet please memphis music like heatwave white lightning bound drive wild mama baby heart every schoolgirl love tender leaf cryin aisle way moved sin sweet true always wanting leave longing might also like black velvet little boy smile black velvet slow southern style new religion bring knee black velvet please every word every song sang flash gone happened soon could black velvet little boy smile black velvet slow southern style new religion bring knee black velvet please black velvet little boy smile black velvet slow southern style new religion bring knee black velvet please please please please 
"""Release Me""",know time change mmm change come still feel many time tried turn love around wan give baby time two foot ground release release gone help wondering ohh come high would right release release come baby come baby knew time let cause wan free somehow easy come darlin hear darlin cause waste time trying make see baby got release release release might also like going back anymore finally weakened heart healing though slow stop coming around door cause gon find looking ohh come baby come baby knew time let cause wan free somehow easy baby come darlin hear darlin cause waste time trying make see baby got release tell power got power ohh come baby come baby knew time let cause wan free somehow easy baby come darlin hear darlin cause waste time trying make see baby got release release release release release ahh release release release 
"""Don't Know Much""",look face know year showing look life still know going know much know love may need know look eye never seen matter look dream beaten battered know much know love may need know many question still left unanswered much never broken feel near sometimes see clearly truth never know might also like look man blessed inspiration look soul still searching salvation know much know love may need know know much know love may need know know much know love may 
"""All Around the World""",know baby find somewhere somehow got let know much care never give looking baby around world find baby know know gone away know baby gon find quarrel let said many thing thing know bad think comin back gave reason reason said thing said mad think comin comin back much lyin wasted much time cryin might also like around world find baby know know gone away know baby gon find open hearted never wrong one weakest one sad think comin back comin back much lyin wasted much time cryin around world find baby know know gone away know baby gon find around world find baby know know gone away know baby gon find going find baby much lyin wasted much time cryin around world find baby know know gone away know baby gon find around world lookin baby around world gon gon find around world find baby know know gone away know baby gon find 
"""I Wanna Be Rich""",cash cold need bill collector ring phone bother home time fooling round foot touch floor get see want money lot lot money want pie sky want money lot lot money asking wan rich ohh wan rich ohh wan rich ohh wan rich little love peace happiness want cake wan eat want star silver moon spend money lottery favorite number see want money lot lot money want pie sky want money lot lot money asking might also likei wan rich ohh wan rich ohh wan rich ohh wan rich little love peace happiness every way rich love peace happiness want thing lover pocketful dream come true thing find keep satisfied rich gon say say got baby wan rich wan cause baby want money lot lot money want pie sky want money lot lot money asking wan rich wan rich wan rich wan rich little love peace happiness play baby lot lot everyone wan rich 
"""Rub You the Right Way""",pump bass hey pump bass pump pump bass pump bass pump pump pump pump pump pump pump missin man supply wish command work hard fill need give lesson feel feel good good baby get undressed slip robe lax lax darlin sit back prepare stroked feel magic hand touch rub right way stroke applied tenderness hold rub right way might also like light massage soft caress whenever give rub rub happiness customer satisfaction guarantee sin pleasure please hey hold let show show show pleasure like never known feel magic hand touch rub right way stroke applied tenderness hold rub right way feel magic hand touch rub right way stroke applied tenderness hold rub right way pump bass hey pump bass hey get busy feel good pump pump pump pump girl lax lax yeah feel magic hand touch rub right way stroke stroke baby applied tenderness hold hold baby rub right way rub baby rub baby rub baby rub feel magic hand touch rub right way stroke applied tenderness hold rub right way feel every wish command get undressed sit back relax touch gon rub magic hand give missin man stroke stroke soft caress applied much tenderness hold hold tight let give pleasure like never known feel magic hand touch rub right way stroke applied tenderness hold rub right way feel feel magic touch nothing satisfaction baby stroke stroke hey hey hey hold rub right way feel feel feel touch stroke hey come come feel baby feel baby feel feel feel feel feel baby stroke baby stroke baby stroke baby feel feel baby feel touch feel comin see whatever want whatever want feel got whatever need touch got baby got baby whatever want stroke got hand whatever need hold fulfill need baby feel feel feel feel feel 
"""She Ain't Worth It""",better make track fast double girl jazzy nothing trouble take want every day let know one always mind got attitude lead leaf blue see really waste time one day treat nice turn cold ice think love win end think worth girl worth grief putting ooh might also likeshe worth girl worth believe know know better better better bet bet better get hot leaf cold keep waiting phone cause know always give one try boy town love playing crowd tell really like standing line give everything make sad really want tell friend like say used girl would lie would lie cause one whole wide world could keep satisfied know cause tried jump one thing hate girl play fake try make late another date cause tried make mine last time take dis goodbye worth even though high tip better get grip get grip quick fast hurry cause buckle girl jazzy nothing trouble give everything make sad really want tell friend 
"""If Wishes Came True""",silence fill room memory hear calling close eye like yesterday fade away take back turn back hand time kissed warm september rain warm september rain back heart filled pain could love way wish came true dream night love real holding wish came true would someone always special heart would still lover apart wish came true might also likenow gone feeling lost inside since said goodbye dream still feel touch lying next feeling ecstasy take back turn back hand time kissed warm september rain warm september rain back heart filled pain could love way wish came true dream night love real holding wish came true would someone always special heart would still lover apart wish came true love madly need badly give love one chance wish came true dream night love real holding wish came true would someone always special heart would still lover apart wish came 
"""The Power""",transceptor technology got power power power hey yeah eah like crack whip snap attack front back thing called rap dig like shovel rhyme devil heavenly level bang bass turn treble radical mind day night time wise divine maniac brainiac winnin game lyrical jesse james yeah yeah yeah eah yeah getting kinda heavy getting getting getting kinda heavy getting getting getting kinda heavy getting getting getting kinda heavy getting getting getting kinda heavy might also like got power power power could break heart could break heart apart could break heart could break heart apart got power power power got power power power could break heart could break heart apart could break heart could break heart apart got power power power getting getting getting kinda hectic getting getting getting kinda hectic getting getting getting kinda hectic getting getting getting kinda hectic quality posse say fresh voice go mesh microphone holding copy written lyric stolen snap need police try save voice cease please stay back attack want got power power power could break heart could break heart apart could break heart could break heart apart got power power power got power power power could break heart could break heart apart could break heart could break heart apart got power power power quality posse say fresh voice go mesh microphone holding copy written lyric stolen snap need police try save voice cease please stay back attack want got power power power could break heart could break heart apart could break heart could break heart apart got power power power got power power power could break heart could break heart apart could break heart could break heart apart got power power power got power power power 
