,Lyrics
"""MMMBop""",robyn adele anderson careless whisper timber summer young beautiful wake mariachi version dance hollaback girl blurred line stop come get call maybe gentleman beauty beat worry child die young thrift shop burn backing vocal ashley stroud cristina gatti wiggle say something hudson thames talk dirty get lucky deleted pmj channel problem ariana grande anaconda found love favorite thing paper plane gangsta paradise jealous one love cold water rolling crazy love friday till world end girl wan fun like prayer birthday kissed girl might also likesara niemietz want want cheap trick hey outkast must place naive melody scar beautiful survive love bad romance reboxed needed mykal kilgore heart lean greatest love since gone andrew roland remind lullaby haley reinhart imagine john lennon oops britney spear creep radiohead habit tove lovefool cardigan black hole sun soundgarden mad world gary jules also puddle pity party morgan james take church hozier barbie girl aqua break free ariana grande dream aerosmith man man man world james brown map maroon really care demi lovato casey abrams stacy mom fountain wayne sweet child mine reboxed love haddaway one family guy theme umbrella puddle pity party royal lorde team lorde chandelier sia stressed twenty one pilot viva vida coldplay mad world gary jules also haley reinhart small thing blink maiya sykes look back anger oasis one reboxed boulevard broken dream green day hello adele juicy believe thing called love stop shoshana bean old love stone cold want way sorry poison addie hamilton sunday morning maroon heart glass never forget gon girl blake lewis thong song brightside killer radioactive joey cook rest wicked cage elephant sugar going fallout boy hey delilah plain white say name destiny child aubrey logan ice ice baby vanilla ice heart reboxed stop feeling bad blood give away beauty beast ariana savalas bad romance lady gaga criminal fiona apple pony genuwine blank space taylor swift diggity tlc single lady beyonce shaggy rikrok miche braden sweet child mine gun rose livin prayer bon jovi story life kenton chen closer nine inch nail closer chainsmokers halsey look made taylor swift melinda doolittle stop queen toxic britney spear caroline baran nothing else matter metallica time time cyndi lauper brielle bass reboxed grenade reboxed lavance colley forget focus halo like annie goodchild roar katy perry style taylor swift also von smith boi avril lavigne ashley stroud fancy iggy azalea charli xcx straight paula abdul waterfall tlc dark horse katy perry cristina gatti love harder sweater weather stay hotline bling someday stroke womanizer drunk love von smith rude magic titanium sia david guetta cry river justin timberlake shake taylor swift style taylor swift also annie goodchild dancing dark bruce springsteen merry little christmas call maybe reboxed niia hash pipe weezer end world skeeter davis girl world rihanna michele bachmann concession speech kiah victoria great height kate davis bass blue christmas ada pasternak baby one time britney spear rather clean bandit rayvon owen ignition remix kelly let chainsmokers natalie angst like heaven santeria gunhild carling material girl never gon give karen marie fever variation creep reboxed dani armstrong roxanne police say weezer tony desare pompeii bastille despacito luis fonsi daddy yankee tara louise bye bye bye gim chocolate vonzell solomon star smash mouth every breath take police noah guthrie sledgehammer peter gabriel belle jewel spiderwebs doubt chloe feoranzo surprise radiohead mario jose color wind disney mayre martinez como flor selena clark beckham never gon give jax teenage dirtbag wheatus deandre brackensick side side ariana grande kelley jakle poker face lady gaga sarah marie young bizarre love triangle jeffrey james steal girl jennie lena give love bad name lara johnston heart want want lisa gary nicole adkins hero holly campbell smith thinking loud daniela andrade welcome jungle mari jolene dolly parton thia megia feel good inc gorillaz hannah gill somebody used know gotye wilkie ferguson mind mandy gonzalez despacito annie bosko complicated devi ananda jar heart grace kelly worth pia toscano stefano langone prayer ensemble cast craigslist missed connection valentine day last christmas hit bye bye bye reboxed sync mmmbop hanson instrumentals evolution tap dance harry potter hedwig theme city star game throne theme friend like tap awakens star war tap dance medley incredible tap dancing medley 
"""For You I Will""",whoa yes feelin lost night feel world right call waitin count anytime time get tough anytime best enough one make better protect see nothing cross ocean bring moon hero strength anything need sun sky light way time promise yes shield heart rain let harm come way arm shelter arm let mountain move move mountain forever fortress tall strong keep safe stand beside right wrong might also like cross ocean cross ocean bring moon yeah yeah yeah hero strength anything need sun sky sun light way time promise yeah yeah lay life line fight die every breath soul give word give put faith put faith anything cross ocean cross ocean bring moon ocean hero strength hero anything need sun sky light way time time promise promise cross ocean ooh bring moon across hero strength yeah anything need let hero sun sky baby yeah baby light way time yeah promise promise promise promise whoa promise 
"""You Make Me Wanna...""",make wan leave one ooh yeah start new relationship wit ooh baby think ring thing come along wit make make make makin wan leave one start new relationship wit yeah yeah yeah think ring thing come along wit make make anything began like best friend one used run talk girl havin problem used say okay suggest little nice thing home night lay head seemed think make wan leave one ooh yeah start new relationship wit babe think ring thing come along wit make make wan leave one babe start new relationship wit come come come come think ring thing come along wit yeah make make might also like bad one hooked knowin sad love fallin tell baby bye bye exactly feel inside cause wan need stay really need get together make wan leave one ooh baby start new relationship wit say think ring thing come along wit yeah make make wan leave one ooh baby start new relationship wit think ring thing come along wit yeah hey make make point situation control never meant hurt got let got let may understand goin tried tried fight feeling strong make make make make wan hey make wan make wan make make make make wan make wan ooh babe make wan babe thing make wan ooh ooh ooh yeah come along wit makin makin make wan leave one ooh baby start new relationship wit say think ring thing come along wit yeah make make wan leave one ooh baby start new relationship wit think ring thing come along wit yeah hey make make makin make wan leave one start new relationship wit ooh makin makin makin think ring thing come along wit make make make wan leave one wan leave one start new relationship wit make make 
"""Bitch""",hate world today good know change tried tell look like maybe angel underneath innocent sweet yesterday cried must relieved see softer side understand confused envy little bit everything rolled one bitch lover child mother sinner saint feel ashamed hell dream nothing know want way take may mean stronger man rest assured start make nervous going extreme tomorrow change today mean thing might also like bitch lover child mother sinner saint feel ashamed hell dream nothing know want way think got figured season already changing think cool try save bitch lover child mother sinner saint feel ashamed hell dream nothing know want way bitch tease goddess knee hurt suffer angel undercover numb revived say alive know want way 
"""Nobody""",wan tease wan please wan show baby need want body til last drop want holler want stop love like nobody sex like nobody treat like baby nobody nobody baby nobody like nobody give need nobody night long nobody nobody baby nobody want night come baby let afraid cause bite promise give way like love like nobody sex like nobody lay body nobody nobody baby nobody treat like nobody give need nobody night long nobody nobody baby nobody band keep playin might also like nobody baby nobody baby want right lover yes place one yes need love right right baby come runnin baby yes yes yes baby love like baby nobody gon love baby sex body right baby nobody like nobody nobody baby lay like nobody kiss gon caress body right 
"""Semi-Charmed Life""",doo doo doo doo doo doo doo doo doo doo doo doo doo doo doo doo doo doo doo doo doo doo doo doo packed holding smiling living golden life say life ovation motivation come round go make smile like drug ever want coming keep smiling one stop rhythm divide speak like chorus verse chop another line like coda curse come like freak show take stage give game play say want something else get semi charmed kind life baby baby want something else listening say goodbye might also like doo doo doo doo doo doo doo doo doo doo doo doo doo doo doo doo doo doo doo doo doo doo doo doo sky gold rose taking sip nose wish could get back place back smiling picture would take crystal meth lift break stop come keep stock tick tock rhythm bump drop bumped took hit given bumped bumped said get back place fell asleep inside get back place said want something else get semi charmed kind life baby baby want something else listening say goodbye believe sand beneath toe beach give feeling earthy feeling believe faith grows four right chord make cry feel like could die would alright alright plane came said crashing velvet rip city tripped urge feel alive struggling survive day wearing velvet dress priestess must confess little red panty pas test slide round belly face mattress one hold broken still want little feel hovering ground scared coming run life got jaw locked smile nothing alright alright want something else get life baby want something else listening say goodbye goodbye goodbye goodbye doo doo doo doo doo doo doo doo doo doo doo doo doo doo doo doo doo doo doo doo doo sky gold rose taking sip nose wish could get back place back place used start life doo doo doo doo doo doo doo doo doo doo doo doo doo doo doo doo doo doo doo doo doo want something else 
"""Barely Breathing""",know see clear taste saline kiss away tear really going wishing star black hole surround heavier far believed confusion completely torn must yesterday day born much examine nothing left hide really serious ask say goodbye cause barely breathing find air know kidding imagining care could stand waiting fool another day suppose worth price worth price price would pay everyone keep asking used certain figure attraction feel pain nothing left reason blame ever change cause barely breathing find air know kidding imagining care could stand waiting fool another day suppose worth price worth price price would pay thinking anyway thinking anyway might also like come find may never know changing mind friend foe rise sink every time come please come cause barely breathing find air know kidding imagining care could stand waiting fool another day suppose worth price worth price price would pay thinking anyway thinking anyway know see clear 
"""Hard to Say I'm Sorry""",everybody need little time away heard say even lover need holiday far away hold hard say sorry want stay make promise baby said done part let stand kept away day body want swept away far away one love hold hard say sorry want know hold really want tell sorry could never let make promise said done part let might also like let 
"""Mo Money Mo Problems""",hot tell rock sell store tell flopped copped blue drop whose jewel got rock mostly dolce tube sock old pimp mase know nothing change limp stop till see name blimp guarantee million sale call love luck believe harlem world nigga double play around bet lay nigga know bet know young harlem nigga goldie sound nigga hold cudda schooled game know duty stay humble stay low blow like hootie true pimp nigga spend dough booty yell mase cutie know want like money come across problem see know want like money come across problem see might also like know rather see die see fly call shot rip spot rock rock cop drop know thinking ballin stop nigga never home got call yacht ten year still top thought told stop gon crew got money much longer team much stronger violate day play mess around way cause enough time enough lime shine deal many woman treat dime fair bigger city light time square yea yea yea know want like money come across problem see know want like money come across problem see info dea federal agent mad cause flagrant tap cell phone basement team supreme stay clean triple beam lyrical dream cat see event bent gat holster girl shoulder playboy told mere mics bruise much lose much step stage girl boo much guess cause run lame dude much lose touch never problem get gat true player throw rolies sky wave side side keep hand high give girl eye player please lyrically nigga see flossin jig cover fortune double phone number man got know got dough got flow pizat platinum plus like thizat dangerous trizacks leave as flizat know want like money come across problem see know want like money come across problem see know want like money come across problem see going going somebody tell going know want like money come across problem see know want like money come across problem see know want like money come across problem see 
"""The Freshmen""",young knew everything punk rarely ever took advice guilt stricken sobbin head floor stopped baby breath shoe full rice held responsible cause touching face held responsible fell love first place life remember made think wise never compromise life believe ever die sin merely freshman best friend took week vacation forget girl took week worth valium slept guilt stricken sobbin head floor think never really wept said held responsible cause touching face held responsible fell love first place might also like life remember made think wise never compromise life believe ever die sin merely freshman hey yeah yeah yeah yeah hey yeah hey yeah yeah yeah yeah tried wash hand never talk lacking relationship guilt stricken sobbin head floor fell ice tried slip say held responsible cause touching face held responsible fell love first place life remember made think wise never compromise life believe ever die sin merely freshman life remember made think wise never compromise life believe ever die sin merely freshman merely freshman freshman 
"""I Want You""",anytime need see face close eye taken place crystal mind magenta feeling take shelter base spine sweet like chic cherry cola need try explain hold tight happens might move slightly arm lip face human cannonball need want well come stand little bit closer breathe get bit higher never know hit get ooh want know need ooh die find ooh want know need ooh would die find kind person endorses deep commitment getting comfy getting perfect live look smell perfume like floor know conversation time place interaction lover mate time talking using symbol using word likened deep sea diver swimming raincoat might also like well come stand little bit closer breathe get bit higher never know hit get ooh want know need ooh die find ooh want know need ooh would die find ooh yeah yeah ooh yeah yeah anytime need see face close eye taken place crystal mind magenta feeling take shelter base spine sweet like chic cherry cola need try explain hold tight happens might move slightly arm lip face human cannonball need want ooh want know need ooh die find ooh want know need ooh would die find find ooh want know need ooh die find ooh want know need ooh would die find ooh want know need ooh die find die find ooh want know need find ooh would die find 
"""I Belong to You (Every Time I See Your Face)""",every time see face make want sing every time think love drive crazy every time see face make want sing every time think love drive crazy say lady tell wrong boyfriend come hold key heart love baby baby like wan girl love life babe give baby belong belong belong give love every time see face make want sing every time think love drive crazy every time see face make want sing every time think love drive crazy might also like say lady fine wake mornin see smile face baby queen heart baby belong belong yeah girl love life baby cloudy day fade away come way baby belong belong give love belong belong belong baby every time see face make want sing belong every time think love drive crazy belong belong baby every time see face make want sing every time think love drive crazy higher babe wan get higher love cause belong belong ooh give love every time see face make want sing every time think love drive 
"""Hypnotize""",come sicker average poppa twist cabbage instinct nigga think shit stink pink gator detroit player timbs hooligan brooklyn right dead right head right biggie night poppa smooth since day underoos never lose never choose bruise crew somethin talk come girl walk wan screw yeah poppa puff close like starsky hutch stick clutch dare squeeze three cherry take take take bang every easily busily recently nigga frontin sayin nothin nothin speak piece keep peace come cuban jesus piece peep thank packin askin want got nigga flaunt brooklyn bullshit biggie biggie biggie see sometimes word hypnotize love flashy way guess broke paid biggie biggie biggie see huh sometimes word hypnotize hypnotize love flashy way huh guess broke paid might also like put hoe onto dkny huh miami prefer versace right philly hoe moschino come every cutie booty bought coogi real dookie meaning really shit nigga ride dick frank white push six lexus four half bulletproof glass tint want as gon blast squeeze first ask question last called gangster pas last nigga rappin blunts broad tit bra nage trois sex expensive car still leave pavement condo paid car payment arraignment note plaintiff daughter tied brooklyn basement face guilty stay filthy guilty richer richie til nigga come get come biggie biggie biggie see sometimes word hypnotize love flashy way guess broke paid biggie biggie biggie see huh sometimes word hypnotize hypnotize love flashy way huh guess broke paid fill real millionaire shit fill escargot car one sixty swiftly come wreck buy new one crew run run run crew run run know sick name brand nigga flow girl say sweet like licorice get nigga easy huh girlfriend pen call round ten come sex rug persian right come job hit workin certain poppa freakin speakin leave as leakin like rapper demo tell take clothes slowly slowly hit force like obi obi dick black like toby toby watch roam like romey romey lucky owe safe show homie say homie biggie biggie biggie see sometimes word hypnotize love flashy way guess broke paid biggie biggie biggie see huh sometimes word hypnotize hypnotize love flashy way huh guess broke paid biggie biggie biggie see sometimes word hypnotize love flashy way guess broke paid biggie biggie biggie see sometimes word hypnotize love flashy way guess broke paid biggie biggie biggie see huh sometimes word hypnotize hypnotize love flashy way huh guess broke paid biggie biggie biggie see sometimes word hypnotize love flashy way guess broke paid 
"""Every Time I Close My Eyes""",girl long long time comin yes know worth wait yeah yeah feel like springtime winter feel like christmas june feel like heaven opened gate yeah every time close eye thank lord got yeah got got got every time think pinch cause believe true yeah someone like love yeah yeah yeah baby yeah ooh ooh girl think truly somethin yes yes every bit dream come true yes yes baby baby never rain wonder sun always shine near blessing found somebody like ooh might also like every time close eye thank lord got yeah got got baby got every time think pinch cause believe true yeah baby someone like love think night cried sleep yeah really oughta know much mean right right life life right baby baby yeah yeah tell girl every time close eye thank lord got baby got baby got every time think pinch cause believe true someone like love yeah yeah woo love 
"""In My Bed""",nah nah nah nah true got feeling turn loose somebody getting next want walk around knowin fool cause man lose cool friend keep telling thing going babe deep heart baby hope wrong yes hope wrong know babe somebody sleeping bed bed baby somebody takin place baby somebody sleeping bed baby know mean come home early expecting warm embrace something wrong cause written face hurt bad walk door know one damn thing baby coming back might also like try tell thing still yeah cause made love heard call name call name somebody sleeping bed tonight baby somebody taking sisqo place somebody sleeping bed baby somebody taking place yeah girl want know gave money every thing need gave world yes cause girl yes still ran yeah somebody sleeping bed baby said sleeping bed messin head ooh somebody taking place tell somebody sleeping bed baby said sleeping bed messin head somebody takin place yeah mmm truly love alright would happenin sleepin bed messin head got let somebody sleeping bed baby yes baby babe somebody taking place wan fool somebody sleeping bed baby somebody taking place 
"""Say You'll Be There""",say giving everything joy bring swear last time conversation decided friend hey going round circle tell never end tell fallen love well never ever thought would ayy time got take easy throwing far much emotion fool see falling got make understand giving everything joy bring swear give everything want promise say might also like say sing put two two together see friendship work equation guess show door need say love would better left unsaid giving everything give everything joy bring joy bring swear yes swear want want promise promise yeah want fool see falling got make understand give everything swear promise always giving everything giving everything joy bring joy bring swear yes swear want want promise want promise always giving everything giving everything joy bring joy bring swear yes swear want want promise want promise always giving everything giving everything joy bring joy bring swear yes swear want want promise want promise always 
"""Do You Know (What It Takes)""",always around know see runnin around cheap talk cheap talk yeah need man right right got need guarantee return love given got sure always around always around know take love know take right know take love baby baby heaven know time lonely feeling love echo mind mind yeah never satisfied girl call keep goin living lie might also like guarantee unto let much give buried deep got sure always around always around know take love know know take right know take love baby baby know take know know take waste time lie yeah baby got know got prove always around yeah give everything boy anything got know way know take love know know take right know know know take know take love baby yeah know take right waste time 
"""4 Seasons of Loneliness""",long warmth day gone mine day memory time life empty without side heart belongs matter try get courage love somebody new always fall apart cause compare love release bound ball chain reminiscing love watch four season change come winter breeze chill air drift snow imagine kissing mistletoe springtime make way lilac bloom reminds scent perfume summer burn heat always get hots skinny dippin ocean used autumn shed leaf tree bare feel feel might also like remember night remember night closed eye closed eye vowed would love time every time think thing shared break cry cause get emotional release bound ball chain reminiscing love watch four season change come winter breeze chill air drift snow imagine kissing mistletoe springtime make way lilac bloom reminds scent perfume summer burn heat always get hots skinny dippin ocean used autumn shed leaf tree bare feel loneliness crushed heart killing baby please let love wan know fix cause need love comfort ease pain four season bring loneliness come winter breeze chill air drift snow imagine kissing mistletoe springtime make way lilac bloom reminds scent perfume summer burn heat always get hots skinny dippin ocean used autumn shed leaf tree bare feel feel remember warmth day gone 
"""G.H.E.T.T.O.U.T.""",sittin sittin sittin sittin alone feelin kinda strange lately know goin baby ever since came back town something tellin bullshit goin boy someone else seekin someone else vital tellin creepin findin number jean talkin sleep phantom letter written ghetto sittin home alone somebody else starin phone cause bad yeah might also like obvious thing changed within year one year give half rent get talkin save line somebody else keep walkin cause bad boy someone else seekin someone else vital tellin creepin ooh boy findin number jean yes talkin sleep phantom letter written ghetto sittin home alone somebody else somebody else starin phone cause bad bad sittin home alone mmmm somebody else somebody else starin phone cause bad gave ooh time would know good thing baby stare face boy someone boy someone else seekin someone else vital tellin creepin findin number jean talkin sleep phantom letter written ghetto sittin home alone somebody else somebody else starin phone cause bad bad sittin home alone somebody else somebody else starin phone cause bad lady sing hey hey sittin home alone somebody else starin phone cause bad sittin home alone somebody else starin phone cause bad 
