,Lyrics
"""Wishing on a Star""",follow wishing dream follow mean wishing star follow wishing dream follow mean wish rainbow see wish people really dream wishing tomorrow praying come wishing lovin ever done never thought see time would far away home far away think moment spent let meant might also likeand mean hurt know game love reap sow feel time make baby feel time get back together make best thing baby together whether never feel time make baby feel time get back together make best thing baby together whether never woh woh ooooooo ooooo wishing star follow wishing dream follow mean wish rainbow see wish people never hoping day come day hoping day lovin wishing star follow follow wishing star wish rainbow see oooo wishing wishing wishing wishing star ooo follow wishing wishing wishing wishing star wishing ooooo ooooooooo wishing wishing wishing wishing star wishing wishing wishing wishing 
"""She's Playing Hard to Get""",like playing playing hard playing hard get playing like like playing hard get playing like like like playing tell look eye cause pass say tell smile might also likethat shy playing think see crush feel crush playing hard get admit like like playing hard get admit ooh yeah like like playing hard feel vibe even though said word bet glad reading mind cause much cause much want say nerve say sure see eye say word playing hard still know still know deep feeling smile look eye say word could ever say come baby girl playing hard get know want see eye hide playing hard get playing hard get think see crush feel crush 
"""I Will Always Love You""",stay would way know think every step way always love always love darling bittersweet memory taking goodbye please cry know need always love always love might also like hope life treat kind hope dreamed wish joy happiness wish love always love always love always love always love always love always love darling love ooh always always love 
"""Whoomp! (There It Is)""",party people yeah tag team music full effect brain supreme man steve roll kickin flow kickin flow go little something like tag team back check wreck let begin party party people let hear noise house jump jump rejoice say party party wave hand air shake derriere three word mean gettin busy whoomp hit whoomp whoomp whoomp whoomp whoomp whoomp whoomp whoomp might also like upside inside bout show folk time nigga get mic make motherfuckin party hype takin back old school cause old fool cool wan get mma show way whoomp let hear say whoomp come whoomp little louder whoomp come whoomp louder whoomp come whoomp little louder whoomp come whoomp whoomp shaka laka shaka laka shaka laka shaka whoomp shaka laka shaka laka shaka laka shaka whoomp shaka laka shaka laka shaka laka shaka whoomp shaka laka shaka laka shaka laka shaka point blank gin juice drink invent puff dank rock mic crave skin rip shit find honey dip dip slam dunk stick flip ride double ooh come come whoomp done whoomp come whoomp louder whoomp give whoomp come come whoomp little louder whoomp yeah whoomp come come whoomp yeah hey baby whoomp hey baby whoomp say crazy cause pushing dais underground sound nigga found amazing outstanding demanding commanding people dancing whoo shit breathtaker producer aka undertaker wan come underground old school shovel dig fool dig dig dig dig dig dig dig dig dig dig dig dig dig dig dig dig double flow fly shit school old hard core keep folklore wrecked mic check mad skill flow ill mess steel grille microphone killed party people party tag team whoomp thought knew whoomp whoomp whoomp whoomp whoomp whoomp whoomp whoomp yeah tag team music comin straight cha brain supreme man steve roll bring back bring back bring back whoomp whoomp whoomp whoomp hahaha heard new song tag team girl singing even know haha song lady well whole album dope real damn really though 
"""Can't Help Falling in Love""",wise men say fool rush help falling love wise men say fool rush help falling love shall stay would sin help falling love river flow gently sea darling go thing meant take hand take whole life help falling love might also like river flow surely sea darling go thing meant take hand take whole life help falling love help falling love help falling love help falling love 
"""That's the Way Love Goes""",like moth flame burned fire love blind see desire way love go way love way love way love go like moth flame burned fire way love blind see desire way like moth flame burned fire way love blind see desire way love go like moth flame burned fire way way way love go way love go love blind see desire way way way love go come worry gon make crazy give time life gon take place never happy came ooh gon take ooh might also like way love go way love go way love go way love go desire way way love go desire way way love go mind light candle like watch play baby got like come closer baby closer reach feel body gon give love way love go sugar hurry got night close eye hold tight way way ooh baby stop stop deeper baby deeper feel good gon cry gon take ooh way love go way love go way love go way love go way love go way love go way love go way love go know way like moth flame burned fire love blind see desire like moth flame burned fire love blind see desire way way ooh way way way love go way way way love go way love go way way way way way love go go go way way way love go way love go way love go way love go way love go way love go way love way love way love way love way love way love way love go 
"""Freak Me""",freak baby yeah freak baby like freak baby yeah freak baby yeah let lick til say stop let play body baby make real hot let thing want cause tonight baby wan get freaky baby understand wan nasty man wan make body scream know mean know mean carat gold want night grow old wan lick baby yeah baby yeah wan lay come silk sing let lick til say stop lick let play body baby make real hot let make real hot let thing want cause tonight baby wan get freaky might also like love taste whipped cream hey spread mean baby mean know resist girl fly around world around world baby wan see body drip come let take sip come come come come take cherish come cause brag like brag boast come come come baby let lick til say stop lick baby let play body baby make real hot wan play body baby wan play body girl let thing want yeah cause tonight baby wan get freaky let freak yeah come come let cause tonight baby wan get freaky let lick til say stop freak baby let play body baby make real hot freak baby let thing want freak baby cause tonight baby wan get freaky let lick til say stop baby stop baby stop let play body baby make real hot baby stop let thing want baby stop baby stop cause tonight baby wan get freaky freaky let lick til say stop let play body baby make real hot let make soakin wet baby let thing want play around love baby cause tonight baby wan get freaky 
"""Weak""",know done caused act crazy way whatever feeling want stay cause heart start beating triple time thought loving mind figure cause cure get weak knee hardly speak lose lose control something take control take daze amazing amaze phase want stay stay side swallow pride pride love sweet knock right foot explain lovin make weak time time time try fight love strong keep holding resistance around cry fading condition want alone might also like cause heart start beating triple time thought loving mind figure cause cure ohh get weak knee hardly speak lose lose control something take control take daze amazing amaze phase want stay stay side swallow pride pride love sweet knock right foot explain lovin make weak try hard fight way deny love sweet knock foot get weak knee hardly speak lose lose control something take control take daze amazing amaze phase want stay stay side swallow pride pride love sweet knock right foot explain lovin make weak get weak blood start racing vein get weak boy something explain get weak something bout way thing knock right foot ohh foot explain lovin make weak get weak knee hardly speak lose lose control something take control take daze amazing amazing phase want stay want stay side swallow pride pride love sweet knock right foot ohh explain lovin make weak 
"""If I Ever Fall in Love""",first time saw brown eye lip said hello said knew right one caught physical attraction satisfaction baby face ever ever fall love sure lady friend ever ever fall love true true sure lady like yeah yeah yeah next time friend say could one promise promise promise promise never leave lonely wan one need baby wan one serve sometimes feel deserve cherish every moment share might also like ever ever fall love sure lady friend ever fall ever fall love true true sure lady like friend next time friend someone believe need someone friend friend next time friend thick thin friend next time friend someone believe please share love friend friend next time friend need someone like ever ever fall love sure lady friend ever fall ever fall love true true sure lady like 
"""Dreamlover""",need lover give kind love last always need somebody uplifting take away baby want lover know understands feel inside someone comfort hold long lonely night till dawn take away dreamlover come rescue take take take anywhere want baby need desperately please come around cause wan share forever baby want another pretender disillusion one time whispering word forever playing mind baby might also like need someone hold kind love fly away want someone belong every day life always come take away dreamlover come rescue take take take anywhere want baby need desperately please come around cause wan share forever baby baby come take away dreamlover come rescue take take take take anywhere want baby need desperately need baby please come around please cause wan share forever baby need need take come baby baby 
"""Rump Shaker""",yeah wan zoom zoom zoom zoom yeah pum pum shake rump rump shaker wan zoom zoom zoom zoom pum pum shake rump rump shaker wan zoom zoom zoom zoom pum pum shake rump rump shaker wan zoom zoom zoom zoom pum pum shake rump rump shaker wan zoom zoom zoom zoom pum pum shake rump rump shaker check baby check baby one two three four check baby check baby one two three check baby check baby one two check baby check baby one called rump shaker beat like sweeter candy feelin manly shaker comin handy slide cloth new york virginia ticklin around delaware enter turn seduction face hip foot wiggle jiggle make night complete since got body year come get award hint like long sharp sword flip tail let see shake like dice way shake rump turnin mighty men mouse plus got surprise back breaker let see shake rump like rump shaker might also like wan zoom zoom zoom zoom pum pum shake rump rump shaker wan zoom zoom zoom zoom pum pum shake rump rump shaker wan zoom zoom zoom zoom pum pum shake rump rump shaker wan zoom zoom zoom zoom pum pum shake rump rump shaker yiggidy yes check baby check baby one two three four yiggidy yes yeah check baby check baby one two three yup yup check baby check baby one two yup yup check baby check baby one yup yup teddy ready one two checker wreckx effect effect wrecker track bout honey shakin rump back booty cuties steady shakin relaxin action packed jam like closet beat bound get cold flowin like faucet mean make sit mean make jump yep make hotties party shake rump like way comb hair like stylish clothes wear little thing make wan get wan zoom zoom zoom zoom pum pum shake rump rump shaker wan zoom zoom zoom zoom pum pum shake rump rump shaker wan zoom zoom zoom zoom pum pum shake rump rump shaker wan zoom zoom zoom zoom pum pum shake rump rump shaker let break shake shake shake shake spend every birthday butt naked body soft makin wan squish chest game rumper like sub woofer shake left shake shake right mind stickin every single night come pas pum pum send papa shake baby shake baby shake stoppa let see booty hop hop make booty stop drop booty wop ooh way shakin real really kill makin broth ill whole lotta bill trickin treatin treatin every trick meetin nah nah nah nah nah nah nah yeah shake baby shake shake like wan zoom zoom zoom zoom pum pum shake rump rump shaker wan zoom zoom zoom zoom pum pum shake rump rump shaker wan zoom zoom zoom zoom pum pum shake rump rump shaker wan zoom zoom zoom zoom pum pum shake rump rump shaker check baby check baby one two three four check baby check baby one two three shake rump check baby check baby one two check baby check baby one one shake rump check baby check baby one two three four check baby check baby one two three shake rump check baby check baby one two check baby check baby one one shake rump wan zoom zoom zoom zoom pum pum shake rump rump shaker wan zoom zoom zoom zoom pum pum shake rump rump shaker wan zoom zoom zoom zoom pum pum shake rump rump shaker wan zoom zoom zoom zoom pum pum shake rump rump shaker check baby check baby one two three four check baby check baby one two three shake rump check baby check baby one two check baby check baby one one shake rump check baby check baby one two three four check baby check baby one two three shake rump check baby check baby one two check baby check baby one one shake rump wan zoom zoom zoom zoom pum pum shake rump wan zoom zoom zoom zoom pum pum shake rump wan zoom zoom wan zoom zoom shake rump wan zoom zoom zoom zoom pum pum shake rump rump shaker break yeah shake rump yeah yeah effect yeah peace peace come come come come come come come 
"""Informer""",man ayo yeah going sick tired running block know saying snow came around looking day word word bust informer say daddy snow blame lick boom boom tective man say say daddy snow stab someone lane lick boom boom informer say daddy snow blame lick boom boom tective man say say daddy snow stab someone lane lick boom boom police come blow door break car troo troo window dey put back car station point reach destination destination reachin outta east detention dey looked pant look bottom might also like informer say daddy snow blame lick boom boom tective man say say daddy snow stab someone lane lick boom boom informer say daddy snow blame lick boom boom tective man say say daddy snow stab someone lane lick boom boom bigger dem think dem power pon phone say dat one hour want use call lover lover callin one tamei love heart belly yes say daddy snow haffi cool deadly yes one one daddy snow together love tor informer say daddy snow blame lick boom boom tective man say say daddy snow stab someone lane lick boom boom informer say daddy snow blame lick boom boom tective man say say daddy snow stab someone lane lick boom boom listen better listen listen better listen rock microphone rock steady yes daddy snow article dance say come people dem say come jamaica born raised ghetto want know pure black people man man know yeah shoe tear toe show born one toronto informer say daddy snow blame lick boom boom tective man say say daddy snow stab someone lane lick boom boom informer say daddy snow blame lick boom boom tective man say say daddy snow stab someone lane lick boom boom come nice young lady intelligent yes gentle irie everywhere never lef yes daddy snow roam dance man roam dancin nation never know say daddy snow boom shakata never lay flat one cardboard box yes daddy snow reachin top informer say daddy snow blame lick boom boom tective man say say daddy snow stab someone lane lick boom boom informer say daddy snow blame lick boom boom tective man say say daddy snow stab someone lane lick boom boom sitting round cool dibbie dibbie girl police knock door lick pal rough thing pick line telephone ring take station black hand trail cause hanging snowman gon backed trapped slap face took gap clue wan get warmer turn informer informer say daddy snow blame lick boom boom tective man say say daddy snow stab someone lane lick boom boom informer say daddy snow blame lick boom boom tective man say say daddy snow stab someone lane lick boom boom diggity dum diggity diggity dum 
"""Nuthin' but a 'G' Thang""",one two three four snoop doggy dogg dre door ready make entrance back cause know bout rip shit give microphone first bust like bubble compton long beach together know trouble nothin thang baby two loced nigga goin crazy death row label pay unfadeable please try fade hell yeah back lecture hand perfection perfected let understand young perspective dig bitch find contraceptive never know could earnin man learnin man time burnin man know shit lieutenant pussy good enough get burnt yeah realer real deal holyfield hooker hoe know feel well good enough get broke proper chunk take small piece funky stuff like like like like like like like like like dre creep mic like phantom might also like well peepin creepin creepin damn near got caught cause beeper kept beepin time make impression felt sit back relax strap seat belt never ride like producer rap control micstro time dope rhyme kick know know flow old funky shit add collection selection symbolizes dope take toke choke clue homie snoop dogg came like like like like like like like give fuck chill til next episode got feeling rock side got feeling yeah yeah fallin back as hellafied gangster lean gettin funky mic like old batch collard green capital yes fresh double double double see showin much flex time wreck mic pimpin hoe clockin grip like name dolemite yeah quit think mood motherfuckin shit hell yeah dre dogg got give want got break somethin hell yeah got bumpin city compton take place asked attention mobbin like motherfucker lynchin droppin funky shit makin sucker nigga mumble mic like cookie crumble try get close as get smacked motherfuckin homie doggy dogg got back never let slip cause slip slippin got nina know straight trippin continue put rap put mack bitch talk shit put smack yeah stop told like clock tick tock never always break dawn city call long beach puttin shit together like nigga one better like like like like like give fuck chill til next episode got feeling rock side got feeling yeah yeah got feeling rock side got feeling yeah yeah got feeling rock side got feeling yeah yeah 
"""In the Still of the Nite""",shoo doop shooby doo shoo doop shooby doo shoo doop shooby doo shoo doop shooby woah still shoo doop shooby doo night shoo doop shooby doo held shoo doop shooby doo held tight shoo doop shooby woah love shoo doop shooby doo love shoo doop shooby doo promise never shoo doop shooby doo let shoo doop shooby woah still night ooh still night remember remember night may remember star bright remember remember hope remember pray remember keep shoo wop precious love shoo wop might also like shoo doop shooby doo light shoo doop shooby doo hold shoo doop shooby doo might shoo doop shooby wah still night ooh still night shoo wop shoo wop shoo wop shoo wop shoo wop shoo wop shoo wop shoo wop shoo wop shoo wop shoo wop shoo wop shoo wop shoo wop shoo wop shoo wop shoo doop shooby doo light shoo doop shooby doo hold shoo doop shooby doo might shoo doop shooby wah still night ooh still night still night shoo doop shooby doo shoo doop shooby doo yeah shoo doop shooby doo still night shoo doop shooby woah still night yeah shoo doop shooby doo woah woah woah shoo doop shooby doo yeah yeah yeah yeah shoo doop shooby doo shoo doop shooby woah shoo doop shooby doo shoo doop shooby doo shoo doop shooby doo 
"""Don't Walk Away""",right leave name number get back laughing got love waiting got know love true keep running boy life wan girl cause mood right let come inside tomorrow hide need someone hold baby misunderstand want man need little time invest love walk away boy ooh walk away love hurt walk away boy right say thing like hear push button baby love close wan feel love wan sure need baby every night might also like let come inside tomorrow hide need someone hold baby misunderstand want man need little time invest love walk away boy walk away boy love hurt walk away boy walk away right baby misunderstand want man need little time give love walk away boy walk away right walk away sound like make love walk away boy walk away boy right walk away walk away boy love hurt hurt walk away boy right right yeah walk away boy walk away love hurt walk away boy right 
"""Knockin' da Boots""",yeah doin one lady huh town boy kickin boy luke know sayin cause knockin boot shazam dino goin little somethin real sexy like know sayin hey check verse last night thought back made good love listenin marvin gaye night long want old thing back make moment fact uhhh babe good lovin body rockin knockin boot night long yeah makin love tire break dawn come come turn light let get yeah cause right give good love somebody rockin knockin boot give good love somebody rockin knockin boot somebody rockin baby ooh give good love somebody rockin knockin boot need need give good love somebody rockin knockin boot might also like feel good near always wan close addicted addicted makin love baby night long baby night long long long long good lovin body rockin night long makin love tire break dawn come come turn light let get cause right right right give good love somebody rockin knockin boot give good love somebody rockin knockin boot want baby give good love somebody rockin knockin boot little body body rockin yeah give good love somebody rockin knockin boot complete rockin sweet love somebody rockin knockin boot give mound pleasure cause ready somebody rockin knockin boot ready ready baby somebody rockin knockin boot give everything waitin somebody rockin knockin boot come give baby yeah right intermission tip lady get towel know sayin cause laid like know wait minute kick vamp whoa somebody rockin knockin boot baby whoa want good touch lady baby drivin crazy come somebody rockin knockin boot come rock body rock body baby come rock body yeah hey wan lay somebody rockin knockin boot let make sweet lovin baby turn light low close door somebody rockin knockin boot everything cause ready 
"""Lately""",lately watchin thinkin bout baby everything sittin away watchin day lately watchin thinkin bout baby everything sittin away watchin day ever felt breeze hit heart like wind blowin apart blowin apart spinnin like merry round indication storm touchin wish could weather storm guess heartbreak norm day always remember saddest day sweet november lately watchin thinkin bout baby everything sittin away watchin day lately watchin thinkin bout baby everything sittin away watchin day watchin day might also like baby knee prayin god help please bring baby back right back mmm lovin right wan wrong drown tear sitting singin another sad love song lately watchin thinkin bout baby everything sittin away watchin day lately watchin thinkin bout baby everything sittin away watchin day lately torn apart wish broke heart missin babe missin every day lately torn apart wish broke heart missin babe missin every day lately watchin thinkin bout baby everything sittin away watchin day lately watchin thinkin bout baby everything sittin away watchin day lately watchin thinkin bout baby everything sittin away watchin day lately watchin thinkin bout baby everything sittin away watchin day 
"""Dazzey Duks""",come baby kick daisy chorus creo look girl daisy duke want look girl daisy duke everybody look girl daisy duke want look girl daisy duke say look girl daisy duke really got goin lookin nice sweet showin tan butt cheek like lot showin got girl lookin real cute way kickin daisy duke come baby kick daisy might also likerepeat chorus yeah hit afrika bambattaa hey black boot knee high daisy duke lookin real fly cahoot park sno relate started trend daisy duke ever since summer girl lookin good future behind see many term used express talkin bout booty breast baby got back junk trunk got six pack hell rump please fry shake see many term used relate love girl big booty call dukies pretty brown cheek hangin jean even city girl kick country thing get got good dip dug damn daisy duke turnin say come baby kick daisy repeat chorus yeah hit say look girl daisy duke really got goin yeah kickin sweet long boot foot check way step make brother wan think sex especially nice leg tan drive red mean kind leg like still kickin leg lily white make one difference long kickin daisy duke come baby kick daisy repeat chorus yeah hit hold wait minute bring funky track back bring funky track back bring funky track back bring funky track back bring baby hook stop afrika bambattaa bring baby bring baby kick daisy bring funky track back stop bring baby bring baby let see rock daisy bring funky track back stop bring baby bring baby kick daisy bring funky track back stop bring baby bring baby let see rock daisy bring funky track back stop sno like girl daisy duke stop creo like girl daisy duke stop taylor boy like girl daisy duke stop tony mercedes like daisy duke stop new york miami alabama tennessee stop new jersey boston augusta stop atlanta like girl daisy duke stop texas like girl daisy duke stop like girl daisy duke stop yeah hit come baby kick daisy repeat chorus kick daisy least one woman went kick daisy baby see one woman went kick daisy baby shh one woman went kick daisy baby yeah hold wait min 
"""Show Me Love""",yeah yeah yeah always told got much pride independent side heart said see live someone life never thought would find love sweet never thought would meet someone like well found tell lie love got could take round world show love show love show life baby show one ever needed show love alright waste love wan give tell got show show love show everything know got potential baby let show love might also like show love show life alright baby show one ever needed show love show love alright show love show life show life baby show one ever needed show love alright show love baby show everything got show life show love baby show everything one one ever needed show love alright love miss make sure everything alright give heart give love every day every night show love yeah yeah show life alright baby show one ever needed show love show love alright hey hey show love show life alright baby show one ever needed show love 
