,Lyrics
"""Red Light Special""",take good look look might last time round let touch like let take southern route fast slow got let body flow like attentive like control baby want tonight give red light special night baby want tonight come door take clothes turn red light know want see eye haha might well honest cause body never lie tell secret tell mine feelin quite sexy want tonight move fast let know cause mean move slow like excitement like man go might also like baby want tonight give red light special night baby want tonight come door take clothes turn red light want want let know let know make time got show got show need need want see want see mistake want knee need someone need someone real man real man need someone understands understands woman woman real woman real woman know want know baby want tonight give red light special night baby want tonight come door take clothes turn red light baby want tonight give red light special night baby want tonight come door take clothes turn red light 
"""Runaway""",excuse seen world many place made lot friend many different race fun around world true african sky nairobi mood fell asleep tuscany dreamed one thing missing runaway love yeah yeah yeah yeah runaway love yeah yeah yeah yeah woke australian breeze danced dance aborigine moon glow mexico dreamed one thing missing runaway love yeah yeah yeah yeah runaway love yeah yeah yeah yeah might also like sail water many color need compass love guide way need nobody long got need hurry got everyday want share world see springtime paris feel good reality please make wish come true runaway love yeah yeah yeah yeah know good time yeah know good time yeah please come know good time yeah fun walking rain spain know good time yeah ooh quite hit note good time know good time yeah think know good time 
"""Strong Enough""",god feel like hell tonight tear rage lie last help understand strong enough man man nothing true nothing right let alone tonight cause change way strong enough man lie promise believe lie please leave leave face show make rule try love strong enough man man might also like strong enough man strong enough man strong enough man shown care throwing punch air broken stand would man enough man lie promise believe lie please leave 
"""Colors of the Wind""",think whatever land land earth dead thing claim know rock tree creature life spirit name think people people people look think like walk footstep stranger learn thing never knew never knew ever heard wolf cry blue corn moon asked grinning bobcat grinned sing voice mountain paint color wind paint color wind come run hidden pine trail forest come taste sun sweet berry earth come roll rich around never wonder worth rainstorm river brother heron otter friend connected circle hoop never end might also like ever heard wolf cry blue corn moon let eagle tell sing voice mountain paint color wind paint color wind high sycamore grow cut never know never hear wolf cry blue corn moon whether white copper skinned need sing voice mountain need paint color wind earth still earth paint color wind 
"""Someone to Love""",even like think know would without know live breathe love baby came time need needed baby love got able give heart give someone love someone touch someone hold someone know someone love someone trust someone hold someone know thought never love thought life want face even see another day suddenly nowhere baby appeared dried tear cared baby love truly rescued able fall love give might also like someone love someone touch someone hold someone know someone love someone trust someone hold someone know long life let love inside swallowed pride day arrived side everything right able give heart give someone love someone touch someone hold someone know someone love someone trust someone hold someone know someone love someone touch someone hold someone know someone love someone trust someone hold someone know 
"""Only Wanna Be with You""",come different world like laugh look girl sometimes crazy wonder baby cause dolphin make cry well nothing looking girl like look got nothing left say moan pout get way dance sing want love want wear ring well nothing wan call fool wan might also like put little dylan sittin fence say line great ask meant said shot man named gray took wife italy inherit million buck died came help lucky wan bobby cool wan yeah tangled blue wan call fool wan sometimes wonder ever end get mad friend sometimes crazy wonder baby yeah dolphin make cry nothing wan call fool wan yeah tangled blue wan wan wan wan 
"""If You Love Me""",wan rain parade starting question love made looking affair want love based truth dare hurt pride right decide ready settle want heart time start act like mine light dark love say trust want show need prove love say trust want show need prove see action speak louder word say thing already heard want body without soul want love come might also like hurt pride right decide ready settle want heart time start act like mine light dark love say trust want show need prove love say trust want show prove love say trust show prove say show prove wan touch baby spread love around honey care got show baby true love share show prove say show prove say show prove say show prove say show prove say show prove 
"""In the House of Stone and Light""",mount kailas uncover come restoration wash body clean walking along crooked path wall fallen broken half telling rest til lay head gon house stone light shall cry blind man leave behind house stone light yeah house stone light holy lady show soul tell place must surely old man waiting gate give wisdom give key might also like telling rest til lay head yeah house stone light make way gon beautiful day house stone light house stone light let beneath skin yeah yeah house stone light long spirit war havasupai shaman let reborn embrace sun upon face come day awake child inside house stone light open eye house stone light see house stone light looking beneath skin yeah yeah house stone light coming inside house stone light stone light looking time house stone light see sunshine shelter house stone light house stone light gon let wash water house stone light speaking something must house stone light find soul yeah see clearly must house stone light find soul yeah keep knockin door must house stone light find soul yeah must house stone light find soul yeah must find soul 
"""I Got 5 on It""",creep woah see ridin high woah kinda broke evening got five got five player give brew might chill type like light another joint like cypress hill steal doobies spit loogies puff got buck enough get nevertheless hella fresh rollin joint like cigarette pas cross table like ping pong gone beatin chest like king kong wrap lip around forty come getting another stogie fool kick like shinobi shinobi homie begin many head poppin let friend hit bit unless pull fat crispy five dollar bill real history cause fool havin vacuum lung let hit free hella dumb dumb dumb come school nyoom taylor earlobe avoidin dick teaser skeezers weirdo blowin land like bomb give two buck take puff pas bomb back suck dank like slurpee serious bomb make niggy delirious like eddie murphy got growin pain maggie cause homies nag take dank baggie might also like got five got good grab let get keyed cause got five messin indo weed cause got five got good got stuck tore back cause got five partner let half sack take sack face whenever need crutch keyed till joint burnin hand next time roll hampa burn slow ash burnin hand bruh hoochies hit know got pitch roll joint longer extension hahahaha cause damned get high free hell better bring spliff chief five babysit better pas joint stop hittin cause know got asthma crack open homie guzzle cause know weed system gettin lonely got take whiz test know failed cause done smoked major weed bro every time chris fool rollin fatty tanqueray straight got five got good grab let get keyed cause got five messin indo weed cause got five got good got stuck tore back cause got five got good partner let half sack ayy make right mane stop light mane yester night thang got hung night train fade fade let head east hit stroll roll big hashish wish could fade eighth low budget still rollin two door cutlas old bucket foggy window soggy indo land gettin smoked kinfolk ibeen smoked yuk spray lay town homies play around blaze pound ease speed drink lemon squeeze everybody rolled roller quick fold blunt bunch sticky doja wouh hold suck weed kick feed cause need half like umfufu got five got good grab let get keyed cause got five messin indo weed cause got five got good got stuck tore back cause got five got good partner let half sack 
"""Baby""",yeah baby baby baby baby cha know fine hey yeah yeah baby baby baby baby baby baby think time hey yeah yeah guess time say baby baby make feel come mind keep cool baby baby hold inside wait day see walk trying move close get trying rude baby baby nothin ventured nothin gained tellin baby baby baby baby yeah cha know fine hey yeah yeah whoa baby baby baby baby yeah yeah yeah think time hey yeah yeah word enough baby baby use state intention hope get love baby baby yeah perfect situation cause fit together like hand glove thinkin whoa yeah else say baby ooh baby alone singin song baby might also like baby baby baby baby ooh yeah cha know fine hey yeah yeah fine fine fine yeah baby baby baby baby yeah think time hey yeah yeah whoa whoa yeah baby baby baby baby baby baby cha know fine hey yeah yeah baby fine fine fine fine yeah baby baby baby baby think time hey yeah yeah baby darling darling baby baby thinkin thinkin baby darling whoa baby baby baby yeah thinkin hey yeah yeah yeah yeah baby yeah yeah yeah yeah yeah yeah yeah yeah hey yeah yeah yeah yeah yeah yeah yeah yeah yeah yeah yeah yeah yeah hey yeah yeah yeah yeah yeah yeah yeah yeah yeah yeah yeah yeah yeah yeah yeah hey yeah yeah yeah yeah yeah yeah yeah yeah yeah yeah yeah yeah yeah ooh yeah baby baby baby baby baby baby baby baby baby yeah cha know fine hey yeah yeah fine fine blown mind baby baby baby baby yeah yeah think time hey yeah yeah thinkin time baby baby baby baby whoa cha know fine hey yeah yeah yeah yeah baby baby baby baby yeah yeah think time hey yeah yeah baby yeah hey yeah yeah yeah yeah yeah yeah yeah yeah yeah yeah yeah hey yeah yeah yeah yeah yeah yeah yeah yeah yeah yeah yeah hey yeah yeah yeah yeah yeah yeah yeah yeah yeah yeah yeah hey yeah yeah yeah yeah yeah yeah yeah yeah yeah yeah yeah hey yeah yeah yeah yeah darling yeah yeah yeah yeah yeah yeah yeah baby hey yeah yeah yeah yeah whoa baby yeah yeah yeah yeah yeah yeah yeah thinkin hey yeah yeah yeah yeah thinkin yeah yeah yeah yeah yeah yeah yeah ooh yeah yeah hey yeah yeah yeah yeah yeah yeah yeah yeah yeah yeah yeah ooh yeah yeah yeah hey yeah yeah yeah yeah baby baby baby baby 
"""Run Away""",run away run away run away save life run away run away run away want survive run away run away run away save life run away run away run away want survive money sex full control generation without soul perfect people perfect world behind closed door control life world luxury cold cash money mentality got keep faith got keep faith better keep faith run away run away run away run away save life run away run away run away want survive run away run away run away save life run away run away run away want survive time break free run away better break free run away money sex full control big brother watching unlock brain save soul limit curfew life perfect system take stand fight freedom keep faith got keep faith better keep faith run away might also like run away run away run away save life run away run away run away want survive run away run away run away save life run away run away run away want survive run away run away run away save life run away run away run away want survive run away run away run away save life run away run away run away want survive time break free run away better break free run away keep faith got keep faith better keep faith run away keep faith got keep faith better keep faith run 
"""As I Lay Me Down""",felt like springtime february morning courtyard bird singing praise still recalling thing said make feel right carry today lay sleep pray hold dear though far away whisper name sky wake happy wonder feel high though sorrow heavy hearted til call name sound like church bell whistle train summer evening want meet barefoot barely breathing might also like lay sleep ooh kah koh pray hold dear though far away whisper name sky ooh kah koh wake happy darling lay sleep ooh kah koh pray hold dear though far away whisper name sky ooh kah koh wake happy near like flower need rain though clear every season change see sun come lay sleep ooh kah koh pray hold dear though far away whisper name sky ooh kah koh wake happy lay sleep ooh kah koh pray hold dear though far away whisper name sky ooh kah koh wake happy wonder ooh kah koh mmm sun come ooh kah koh sun come sun come sun come sun come sun come 
"""He's Mine""",might thinking baby think another lover find another brother know man hand feel good call name wish feeling disgust working stuff think mine feeling real high ask cause mine tell something cool never fall love man love waste time telling something wrong one night coming home mine may got time sleep night mine may got time try dry eye mine may got time got time might also like went date late took room gave soon played like trick cuz let hit coming home lover strong got love baby try take wanted piece mistaken cuz belongs baby see tell something cool never fall love man love waste time telling something wrong one night coming home mine may got time sleep night mine may got time try dry eye mine may got time got time time playing game mind need cry dry eye get one night ohh mine may got time sleep night mine may got time try dry eye mine may got time got time 
"""December""",drink water hand contagious think tilt sun towards domain cup runneth scream think aloud turn head baby spit worry bout speak doubt turn head baby spit follow higher ground lost swear throw away basic need ambiance vanity scream think aloud turn head baby spit worry bout speak doubt turn head baby spit scream think aloud turn head baby spit worry bout speak doubt turn head baby spit might also like december promise gave unto december whisper treachery december cloud covering december song longer sing december promise gave unto december whisper treachery december cloud covering december song longer sing december promise gave unto scream think aloud december whisper treachery turn head baby spit december cloud covering worry bout speak doubt december song longer sing turn head baby spit december promise gave unto scream think aloud december whisper treachery turn head baby spit december cloud covering worry bout speak doubt december song longer sing turn head baby spit 
"""I'll Be There for You/You're All I Need to Get By""",nevertheless valentine day approach even cursory glance itunes spotify library bring ton lovey dovey memory anticipation valentine day hiphopdx editorial staff listed favorite rap song whether living single life enjoying occasion significant pick usual need invitation feel free disagree add pick comment section outkast happy valentine day one absolute brainer hallmark holiday soundtrack essential show mix naturally jam band going lyric pouring happy valentine day like ultimate track celebrate coming cupid course one basically andre since love call three stack though cut nah cupid valentino flanked joi skreechy peachy hook much like player ball christmas track celebrated time year jodeci love life younger decided song going played wedding still feel way even though jodeci kind scary looking nowadays love life ultimate eternal love kind tune video though really drive point home boz yes tlc getting married dalvin swing perfect dalvin dating boz time awwww sweet ode love handled least mushy way possible head though boz dalvin long since broken cupid cry hear song heart seriously room might player dwell bad boy group put cupid lie know unless give try sing hook beautiful heartfelt everything need love song next time bumpin peach cream remembering good day forget throw one drake sized cry worth trust raekwon feat cappachino method man ghostface killah ice cream method man mary blige need default hip hop love jam non head subsequent meth appearance alongside rae ghostface cappadonna still going cappachino time usually one appeal hard rock twitter invented dropped back swapmeetlove might become trending hashtag premiere video said three gambinos held entire pre drake generation male trouble articulating emotion lady life trouble getting bended knee propose boo ask ahead walk dog represent besides time get valentine day anthem personifies woman different ethnicity ice cream flavor ghost reference supreme alphabet turn like vine allah rule gladly take fashawn lupita unrequited love rough hip hop one end spectrum feature bottomless well self pity best evidenced pharcyde passin end spectrum channel rejection anger much like ice cube rhymed get play lady six nigga car crazy scared showin said fuck bitch kept goin album boy meet world fashawn struck perfect balance fash retraces step innocent infatuation complete poem writing friend zone ending polite letdown object affection maybe another life lupita offered damn ultimately fashawn took dignity provided playful fun realistic look sometimes happens cupid arrow misfire ugk feelin prior untimely death sweet jones cornering market grown man rap merely throwing button oxford breaking soft rap neptune production pimp laying full linen suit tom joyner boat cruise middle aged mack shout woman value puttin kid temporarily retires abrasive bar favor falsetto backing harmony hook producer steve flipped maze featuring frankie beverly feel feelin mature fare mean bun pimp getting geriatric lady backside swole mix class panache precision get invited affair feature port arthur texas native trading trunk popping two stepping might also likemurs love appreciate detail murs set make generic love song random lovey dovey quote instead nick carter rapped heart love appreciation apply special woman life murs vivid storytelling powerful word sound sincere every bar helping one another pay bill watching favorite television show murs show good love song like good relationship find success detail method man feat mary blige need love always perfect meant comfort comfort shine sky gray someone rub back say baby okay love meant uplift feel like nothin person love make feel like somethin method man captured quite well matching impeccable flow mary blige soothing melody need get valentine card please also may need romance stuff show love method man crafted one best valentine day hip hop song time love song immortal technique feat jean grae never know may cheerful song playlist powerful selection love taken granted never know immortal technique penned chilling story vivid enough movie theater clocking seven minute technique blend heartfelt lyric striking imagery explain love valued moreover song speaks somber tone day story impactful surprising ending technique delivers one masterful performance jean grae provides strong guest spot song sobering reminder one must appreciate love fullest extent beyond cause never really know got gone ply feat bust baby part another term love life bust baby one quite coin term like florida pride joy ply first make song beautiful like forget verse find singing along catchy hook every damn time song different ply brings valentine day worthy quote table kind love see sweetly scribbled yellow post note remind special speakin goon thank god makin one example ply also provides alternative pet name wet wet lil boo packaged together four minute plus song good enough janet jackson good enough day playlist bonus fabolous feat diddy jagged edge trade diddy diddy puff daddy puff daddy diddy joined fabolous revised version fab jagged edge assisted track trade single best known part film barbershop soundtrack alone made made way top billboard hot chart accolade deserves noticed valentine day track girl trade money car everything sings jagged edge harmoniously hook fab whose charm felony diddy woo lady distinct manner desert storm clue duro provide sunny layout brings shine song overall single made make feel 
"""Shy Guy""",want fly guy want shy guy want yeah know want yeah lord mercy mercy mercy man dem inna party party party wollah dem sexy sexy sexy watch dem jus fallah fallah fallah everywhere guh man dem rush yes wul heap pretty bwoy waah love dem love yes dem love true dem know sweet sexy everywhere guh seh ever ready dem love yes dem love want somebody loving everybody need shy guy kinda guy mine might also like lord mercy mercy mercy man dem inna party party party wollah dem sexy sexy sexy watch dem jus fallah fallah fallah mercy mercy mercy nuhn dem nah move move move shy guy weh wanty wanty wanty mek irie irie irie roughneck man nah waan nuhn dem beat body lick head top nah waan nuhn dat nuh waan nuhn dat big ting gwaan shy man dem want yuh lover want yuh friend til end til end want somebody loving everybody need shy guy kinda guy mine lord mercy mercy mercy man dem inna party party party wollah dem sexy sexy sexy watch dem jus fallah fallah fallah mercy mercy mercy nuhn dem nah move move move shy guy weh wanty wanty wanty mek irie irie irie mercy mercy mercy mercy mercy chu man wah seh lord mercy shy man waan hear yuh hol yuh hand inna air mek eye yuh yuh nah one dem nah waah see yuh dis one dedicated shy man crew shy man waah hear yuh hol yuh hand inna air mek eye yuh yuh nah one dem nuh waah see yuh dis one dedicated shy man crew cause want somebody loving everybody need shy guy kinda guy mine lord mercy mercy mercy man dem inna party party party wollah dem sexy sexy sexy watch dem jus fallah fallah fallah mercy mercy mercy nuhn dem nah move move move shy guy weh wanty wanty wanty mek irie irie irie mercy mercy mercy man dem inna party party party wollah dem sexy sexy sexy watch dem jus fallah fallah fallah mercy mercy mercy nuhn dem nah move move move shy guy weh wanty wanty wanty mek irie irie irie shy guy shy guy shy guy tink done jus come mercy mercy mercy inna party party party andy kingsley kingsley kingsley jus jam jam jam jam jam jam party party party mercy mercy mercy whole dem inna party party party feelin irie irie irie dem jus follow follow follow 
"""I'm the Only One""",please baby see mind burnin hell got razor rippin tearin strippin heart apart well tonight told ache something new woman looking like somethin might good hold til screaming gone believe tell nothing wrong one walk across fire one drown desire fear make run demon hiding promise gone one please baby see trying explain locking door going back eye arm skin make away wake tomorrow wrestle sorrow hold today might also like hold til screaming gone believe tell nothing wrong one walk across fire one drown desire fear make run demon hiding promise gone one hold til screaming gone believe tell nothing wrong one walk across fire one drown desire fear make run demon hiding promise gone one one drown desire fear make run demon hiding promise gone one one one nobody else gon love 
"""Every Little Thing I Do""",mind mind mind mind every little thing mind way feel lately driving crazy every little thing mind get think time see think time mind hazy mixed feeling crazy let waste time every little thing mind way feel lately driving crazy every little thing mind get think time round round stop know guess mind take time think let know wan baby good might also like every little thing mind way feel lately driving crazy every little thing mind get think time every little thing mind mind hey every little thing mind mind hey every little thing mind mind hey every little thing mind mind hey every little thing mind way feel lately driving crazy every little thing mind get think time every little thing mind way feel lately driving crazy every little thing mind get think time every little thing mind way feel lately driving crazy every little thing mind get think time way feel lately driving crazy every little thing mind mind hey every little thing mind mind hey every little thing mind mind hey every little thing mind mind hey every little thing mind mind hey every little thing mind mind hey every little thing mind mind hey every little thing mind mind hey 
"""Before I Let You Go""",let let get kiss goodnight baby let let get kiss goodnight baby let let get kiss goodnight baby let let get kiss goodnight baby lately thinking something going wrong cause got attitude mood like used girl feel hold arm feeling one blame wan lose love wan say bye bye true love hard find right lip mine mine let let away get kiss goodnight let away get kiss goodnight might also like listen baby turn light low let take nice slow mission keep mine want last time make sweet love baby know feel bigger one thing certain wan lose love wan lose wan say bye bye wan lose always little thing remember let slip away slip away let away get kiss goodnight let away get kiss goodnight teddy play music teddy play blackstreet say wan lose baby get lonely sometimes wan lose baby heart broken sometimes need right wan loose let slip away slip away let let away get kiss goodnight let away get kiss goodnight let let get kiss goodnight baby let let get kiss goodnight baby let let get kiss goodnight baby let let get kiss goodnight baby want lose sweet love say goodbye say goodnight 
